{
  "$schema": "https://schemas.cpipe.dev/pipeline/v0.2.json",
  "version": "0.2",
  "id": "invalid-dangling-edge",
  "inputs": [
    {
      "port": "raw",
      "kind": "Image2D",
      "format": "R8G8B8A8_UNORM",
      "width": 64,
      "height": 64
    }
  ],
  "nodes": [
    {
      "id": "copy",
      "type": "com.cpipe.builtin.passthrough",
      "params": {}
    }
  ],
  "edges": [
    {
      "from": "missing.out",
      "to": "copy.in"
    }
  ]
}
