{
  "$schema": "https://schemas.cpipe.dev/pipeline/v0.2.json",
  "version": "0.2",
  "id": "precision-auto-insert",
  "inputs": [
    {
      "port": "raw",
      "kind": "Image2D",
      "format": "R8G8B8A8_UNORM",
      "width": 4,
      "height": 4
    }
  ],
  "nodes": [
    {
      "id": "producer",
      "type": "com.cpipe.test.rgba16_producer",
      "params": {}
    },
    {
      "id": "consumer",
      "type": "com.cpipe.test.rgba8_consumer",
      "params": {}
    }
  ],
  "edges": [
    {
      "from": "producer.out",
      "to": "consumer.in"
    }
  ]
}
